{
  "profile": "https://minorityprophet.org/conformance/a2a-mcp-crossing/v2",
  "grade": "implementation_independent",
  "corpus_sha256": "f7a72b5c1c0473080aff468d1af6b0500d035d6a00ebbfce1d2499a0897534fb",
  "implementation": {
    "a2a": "HandoffProbe protocol-lab using @a2a-js/sdk 1.1.0 with transport-authenticated caller observation and server-resolved task/context",
    "mcp": "HandoffProbe protocol-lab using MCP TypeScript SDK 2.0.0 with transport audience and exact pre-dispatch tool/arguments observation",
    "verifier": "HandoffProbe crossing authority verifier at commit a91110245c3932fd98b3156b2595836927566ede",
    "operator": "Heaviside479 / HandoffProbe"
  },
  "results": [
    {
      "case": "valid_crossing",
      "native": {
        "measurement": "externally_observed",
        "attempts": [
          {
            "attempt": 1,
            "outcome": "succeed",
            "reason": "accepted",
            "effect_before": 0,
            "effect_after": 1,
            "effect_delta": 1
          }
        ]
      },
      "bound": {
        "measurement": "externally_observed",
        "attempts": [
          {
            "attempt": 1,
            "outcome": "succeed",
            "reason": "accepted",
            "effect_before": 0,
            "effect_after": 1,
            "effect_delta": 1
          }
        ]
      }
    },
    {
      "case": "existing_task_valid",
      "native": {
        "measurement": "externally_observed",
        "attempts": [
          {
            "attempt": 1,
            "outcome": "succeed",
            "reason": "accepted",
            "effect_before": 0,
            "effect_after": 1,
            "effect_delta": 1
          }
        ]
      },
      "bound": {
        "measurement": "externally_observed",
        "attempts": [
          {
            "attempt": 1,
            "outcome": "succeed",
            "reason": "accepted",
            "effect_before": 0,
            "effect_after": 1,
            "effect_delta": 1
          }
        ]
      }
    },
    {
      "case": "existing_task_stage_evidence_present",
      "native": {
        "measurement": "externally_observed",
        "attempts": [
          {
            "attempt": 1,
            "outcome": "succeed",
            "reason": "accepted",
            "effect_before": 0,
            "effect_after": 1,
            "effect_delta": 1
          }
        ]
      },
      "bound": {
        "measurement": "externally_observed",
        "attempts": [
          {
            "attempt": 1,
            "outcome": "reject",
            "reason": "stage_evidence_unexpected",
            "effect_before": 0,
            "effect_after": 0,
            "effect_delta": 0
          }
        ]
      }
    },
    {
      "case": "existing_task_previous_stage_present",
      "native": {
        "measurement": "externally_observed",
        "attempts": [
          {
            "attempt": 1,
            "outcome": "succeed",
            "reason": "accepted",
            "effect_before": 0,
            "effect_after": 1,
            "effect_delta": 1
          }
        ]
      },
      "bound": {
        "measurement": "externally_observed",
        "attempts": [
          {
            "attempt": 1,
            "outcome": "reject",
            "reason": "input_contract_invalid",
            "effect_before": 0,
            "effect_after": 0,
            "effect_delta": 0
          }
        ]
      }
    },
    {
      "case": "caller_swap",
      "native": {
        "measurement": "externally_observed",
        "attempts": [
          {
            "attempt": 1,
            "outcome": "succeed",
            "reason": "accepted",
            "effect_before": 0,
            "effect_after": 1,
            "effect_delta": 1
          }
        ]
      },
      "bound": {
        "measurement": "externally_observed",
        "attempts": [
          {
            "attempt": 1,
            "outcome": "reject",
            "reason": "caller_mismatch",
            "effect_before": 0,
            "effect_after": 0,
            "effect_delta": 0
          }
        ]
      }
    },
    {
      "case": "message_swap",
      "native": {
        "measurement": "externally_observed",
        "attempts": [
          {
            "attempt": 1,
            "outcome": "succeed",
            "reason": "accepted",
            "effect_before": 0,
            "effect_after": 1,
            "effect_delta": 1
          }
        ]
      },
      "bound": {
        "measurement": "externally_observed",
        "attempts": [
          {
            "attempt": 1,
            "outcome": "reject",
            "reason": "message_mismatch",
            "effect_before": 0,
            "effect_after": 0,
            "effect_delta": 0
          }
        ]
      }
    },
    {
      "case": "task_swap",
      "native": {
        "measurement": "externally_observed",
        "attempts": [
          {
            "attempt": 1,
            "outcome": "succeed",
            "reason": "accepted",
            "effect_before": 0,
            "effect_after": 1,
            "effect_delta": 1
          }
        ]
      },
      "bound": {
        "measurement": "externally_observed",
        "attempts": [
          {
            "attempt": 1,
            "outcome": "reject",
            "reason": "task_mismatch",
            "effect_before": 0,
            "effect_after": 0,
            "effect_delta": 0
          }
        ]
      }
    },
    {
      "case": "context_swap",
      "native": {
        "measurement": "externally_observed",
        "attempts": [
          {
            "attempt": 1,
            "outcome": "succeed",
            "reason": "accepted",
            "effect_before": 0,
            "effect_after": 1,
            "effect_delta": 1
          }
        ]
      },
      "bound": {
        "measurement": "externally_observed",
        "attempts": [
          {
            "attempt": 1,
            "outcome": "reject",
            "reason": "context_mismatch",
            "effect_before": 0,
            "effect_after": 0,
            "effect_delta": 0
          }
        ]
      }
    },
    {
      "case": "requester_omitted_both",
      "native": {
        "measurement": "externally_observed",
        "attempts": [
          {
            "attempt": 1,
            "outcome": "succeed",
            "reason": "accepted",
            "effect_before": 0,
            "effect_after": 1,
            "effect_delta": 1
          }
        ]
      },
      "bound": {
        "measurement": "externally_observed",
        "attempts": [
          {
            "attempt": 1,
            "outcome": "reject",
            "reason": "input_contract_invalid",
            "effect_before": 0,
            "effect_after": 0,
            "effect_delta": 0
          }
        ]
      }
    },
    {
      "case": "message_omitted_both",
      "native": {
        "measurement": "externally_observed",
        "attempts": [
          {
            "attempt": 1,
            "outcome": "succeed",
            "reason": "accepted",
            "effect_before": 0,
            "effect_after": 1,
            "effect_delta": 1
          }
        ]
      },
      "bound": {
        "measurement": "externally_observed",
        "attempts": [
          {
            "attempt": 1,
            "outcome": "reject",
            "reason": "input_contract_invalid",
            "effect_before": 0,
            "effect_after": 0,
            "effect_delta": 0
          }
        ]
      }
    },
    {
      "case": "task_omitted_both",
      "native": {
        "measurement": "externally_observed",
        "attempts": [
          {
            "attempt": 1,
            "outcome": "succeed",
            "reason": "accepted",
            "effect_before": 0,
            "effect_after": 1,
            "effect_delta": 1
          }
        ]
      },
      "bound": {
        "measurement": "externally_observed",
        "attempts": [
          {
            "attempt": 1,
            "outcome": "reject",
            "reason": "input_contract_invalid",
            "effect_before": 0,
            "effect_after": 0,
            "effect_delta": 0
          }
        ]
      }
    },
    {
      "case": "context_omitted_both",
      "native": {
        "measurement": "externally_observed",
        "attempts": [
          {
            "attempt": 1,
            "outcome": "succeed",
            "reason": "accepted",
            "effect_before": 0,
            "effect_after": 1,
            "effect_delta": 1
          }
        ]
      },
      "bound": {
        "measurement": "externally_observed",
        "attempts": [
          {
            "attempt": 1,
            "outcome": "reject",
            "reason": "input_contract_invalid",
            "effect_before": 0,
            "effect_after": 0,
            "effect_delta": 0
          }
        ]
      }
    },
    {
      "case": "audience_swap",
      "native": {
        "measurement": "externally_observed",
        "attempts": [
          {
            "attempt": 1,
            "outcome": "succeed",
            "reason": "accepted",
            "effect_before": 0,
            "effect_after": 1,
            "effect_delta": 1
          }
        ]
      },
      "bound": {
        "measurement": "externally_observed",
        "attempts": [
          {
            "attempt": 1,
            "outcome": "reject",
            "reason": "audience_mismatch",
            "effect_before": 0,
            "effect_after": 0,
            "effect_delta": 0
          }
        ]
      }
    },
    {
      "case": "tool_swap",
      "native": {
        "measurement": "externally_observed",
        "attempts": [
          {
            "attempt": 1,
            "outcome": "succeed",
            "reason": "accepted",
            "effect_before": 0,
            "effect_after": 1,
            "effect_delta": 1
          }
        ]
      },